{
  "bundle_version": 1,
  "receiver": "cfmeet.privacy-relay",
  "runtime_environment": "staging",
  "trusted_issuers": [
    {
      "issuer": "cfmeet.calling",
      "audience": "cfmeet.privacy-relay",
      "runtime_environment": "staging",
      "keys": [],
      "permissions": [
        "communication.authorize",
        "communication-context.read"
      ]
    },
    {
      "issuer": "cfmeet.telephony",
      "audience": "cfmeet.privacy-relay",
      "runtime_environment": "staging",
      "keys": [
        {
          "kid": "telephony-staging-2026-10",
          "kty": "OKP",
          "crv": "Ed25519",
          "x": "P8rXnOcoHr4pxy6hboXDb2e4uJCs6mnFB4qyLCk2Zt4"
        }
      ],
      "permissions": [
        "communication-context.read",
        "protected-contact.resolve-for-execution"
      ]
    }
  ]
}
